{
  "crawler": {
    "dialect": {
      "name": "dsp-plugin",
      "version": "0.1"
    },
    "granularity": "file",
    "inventory": {
      "crawled": 42,
      "excluded": [],
      "files": 42
    },
    "languages": [
      "cpp",
      "yaml"
    ],
    "name": "loupe-crawl",
    "scope": {
      "exclude": [],
      "include": [
        "src/**/*.cpp",
        "src/**/*.hpp",
        "config/**/*.yml"
      ],
      "resolution": "heuristic"
    },
    "version": "0.0.0-sample"
  },
  "edges": [
    {
      "count": 1,
      "dst": "file:foundations/adaa.hpp",
      "evidence": [
        {
          "line": 1,
          "path": "src/fx/multistage_shaper.cpp",
          "type": "site"
        }
      ],
      "id": "e:036eb37df0ad4333",
      "kind": "include",
      "provenance": "static",
      "src": "file:src/fx/multistage_shaper.cpp"
    },
    {
      "count": 1,
      "dst": "file:foundations/dsp_math.hpp",
      "evidence": [
        {
          "line": 1,
          "path": "src/dynamics/consonance_gravity.cpp",
          "type": "site"
        }
      ],
      "id": "e:0dd1514e28890c47",
      "kind": "include",
      "provenance": "static",
      "src": "file:src/dynamics/consonance_gravity.cpp"
    },
    {
      "count": 1,
      "dst": "file:src/mod/intent_bus.cpp",
      "evidence": [
        {
          "line": 1,
          "path": "src/mod/mod_matrix.cpp",
          "signature": "ModTarget::apply(IntentId, depth)",
          "type": "site"
        }
      ],
      "id": "e:101e76d7f6953543",
      "kind": "call",
      "provenance": "static",
      "role": "mod",
      "roleRule": "dsp-plugin/mod-by-signature",
      "src": "file:src/mod/mod_matrix.cpp"
    },
    {
      "count": 1,
      "dst": "file:src/engines/station/lfsr_noise.cpp",
      "evidence": [
        {
          "line": 1,
          "path": "src/engines/station/pm_operator.cpp",
          "type": "site"
        }
      ],
      "id": "e:118bb3511dce09e3",
      "kind": "call",
      "provenance": "static",
      "src": "file:src/engines/station/pm_operator.cpp"
    },
    {
      "count": 1,
      "dst": "file:src/mod/inertia.cpp",
      "evidence": [
        {
          "line": 1,
          "path": "src/mod/quantum_morph.cpp",
          "type": "site"
        }
      ],
      "id": "e:1388aa9205dd8519",
      "kind": "call",
      "provenance": "static",
      "src": "file:src/mod/quantum_morph.cpp"
    },
    {
      "count": 1,
      "dst": "file:foundations/smoother.hpp",
      "evidence": [
        {
          "line": 1,
          "path": "src/fx/filter.cpp",
          "type": "site"
        }
      ],
      "id": "e:13e1cb814c443167",
      "kind": "include",
      "provenance": "static",
      "src": "file:src/fx/filter.cpp"
    },
    {
      "count": 1,
      "dst": "file:src/mod/quantum_morph.cpp",
      "evidence": [
        {
          "line": 1,
          "path": "src/plugin/state_io.cpp",
          "type": "site"
        }
      ],
      "id": "e:14c7d32bf6132e7b",
      "kind": "call",
      "provenance": "static",
      "src": "file:src/plugin/state_io.cpp"
    },
    {
      "count": 1,
      "dst": "file:src/engines/saw/kuramoto_core.cpp",
      "evidence": [
        {
          "line": 1,
          "path": "tests/parity_tests.cpp",
          "type": "site"
        }
      ],
      "id": "e:15835d035e698fd1",
      "kind": "test",
      "provenance": "static",
      "src": "file:tests/parity_tests.cpp"
    },
    {
      "count": 1,
      "dst": "art:tests/goldens/*.bin",
      "evidence": [
        {
          "line": 1,
          "path": "tests/parity_tests.cpp",
          "type": "site"
        }
      ],
      "id": "e:167d7ba0bc5fbba7",
      "kind": "data",
      "provenance": "static",
      "src": "file:tests/parity_tests.cpp"
    },
    {
      "count": 1,
      "dst": "file:src/fx/fx_router.cpp",
      "evidence": [
        {
          "line": 1,
          "path": "src/engines/saw/saw_voice.cpp",
          "signature": "render(AudioBlock&)",
          "type": "site"
        }
      ],
      "id": "e:177af86570a9f8fa",
      "kind": "call",
      "provenance": "static",
      "role": "audio",
      "roleRule": "dsp-plugin/audio-by-signature",
      "src": "file:src/engines/saw/saw_voice.cpp"
    },
    {
      "count": 1,
      "dst": "file:src/mod/intent_bus.cpp",
      "evidence": [
        {
          "line": 1,
          "path": "src/ui/xy_pad_view.cpp",
          "type": "site"
        }
      ],
      "id": "e:1a29a56b95e650b3",
      "kind": "call",
      "provenance": "static",
      "src": "file:src/ui/xy_pad_view.cpp"
    },
    {
      "count": 1,
      "dst": "file:src/plugin/processor.cpp",
      "evidence": [
        {
          "line": 1,
          "path": "src/plugin/clap_entry.cpp",
          "type": "site"
        }
      ],
      "id": "e:1b3c088254220733",
      "kind": "call",
      "provenance": "static",
      "src": "file:src/plugin/clap_entry.cpp"
    },
    {
      "count": 1,
      "dst": "file:src/mod/inertia.cpp",
      "evidence": [
        {
          "line": 1,
          "path": "src/engines/saw/detune_law.cpp",
          "type": "site"
        }
      ],
      "id": "e:1b7a53d18006c96d",
      "kind": "call",
      "provenance": "static",
      "src": "file:src/engines/saw/detune_law.cpp"
    },
    {
      "count": 1,
      "dst": "file:src/engines/choir/vowel_field.cpp",
      "evidence": [
        {
          "line": 1,
          "path": "src/engines/choir/fof_grain.cpp",
          "type": "site"
        }
      ],
      "id": "e:1ce97d4b2d188e7d",
      "kind": "call",
      "provenance": "static",
      "src": "file:src/engines/choir/fof_grain.cpp"
    },
    {
      "count": 1,
      "dst": "file:src/engines/saw/kuramoto_core.cpp",
      "evidence": [
        {
          "line": 1,
          "path": "src/engines/saw/saw_voice.cpp",
          "type": "site"
        }
      ],
      "id": "e:1ea9cfe86e5d300e",
      "kind": "call",
      "provenance": "static",
      "src": "file:src/engines/saw/saw_voice.cpp"
    },
    {
      "count": 1,
      "dst": "file:src/ui/xy_pad_view.cpp",
      "evidence": [
        {
          "line": 1,
          "path": "src/ui/editor.cpp",
          "type": "site"
        }
      ],
      "id": "e:23841e4e14826db2",
      "kind": "include",
      "provenance": "static",
      "src": "file:src/ui/editor.cpp"
    },
    {
      "count": 1,
      "dst": "file:src/ui/scope_view.cpp",
      "evidence": [
        {
          "line": 1,
          "path": "src/ui/editor.cpp",
          "type": "site"
        }
      ],
      "id": "e:2839f6c66849d624",
      "kind": "include",
      "provenance": "static",
      "src": "file:src/ui/editor.cpp"
    },
    {
      "count": 1,
      "dst": "file:src/engines/saw/kuramoto_core.cpp",
      "evidence": [
        {
          "line": 1,
          "path": "src/mod/mod_matrix.cpp",
          "signature": "ModTarget::apply(IntentId, depth)",
          "type": "site"
        }
      ],
      "id": "e:29d1a3611fd22a90",
      "kind": "call",
      "provenance": "static",
      "role": "mod",
      "roleRule": "dsp-plugin/mod-by-signature",
      "src": "file:src/mod/mod_matrix.cpp"
    },
    {
      "count": 1,
      "dst": "file:verify",
      "evidence": [
        {
          "line": 1,
          "path": ".github/workflows/ci.yml",
          "type": "site"
        }
      ],
      "id": "e:32c3ad6169fcc5fe",
      "kind": "call",
      "provenance": "static",
      "src": "art:.github/workflows/ci.yml"
    },
    {
      "count": 1,
      "dst": "file:foundations/param_store.hpp",
      "evidence": [
        {
          "line": 1,
          "path": "src/plugin/param_registry.cpp",
          "type": "site"
        }
      ],
      "id": "e:362d8912576b110f",
      "kind": "include",
      "provenance": "static",
      "src": "file:src/plugin/param_registry.cpp"
    },
    {
      "count": 1,
      "dst": "file:src/fx/fx_router.cpp",
      "evidence": [
        {
          "line": 1,
          "path": "src/engines/station/pm_operator.cpp",
          "signature": "render(AudioBlock&)",
          "type": "site"
        }
      ],
      "id": "e:38fd05eddc2e902f",
      "kind": "call",
      "provenance": "static",
      "role": "audio",
      "roleRule": "dsp-plugin/audio-by-signature",
      "src": "file:src/engines/station/pm_operator.cpp"
    },
    {
      "count": 1,
      "dst": "file:src/engines/warp/simplex_shaper.cpp",
      "evidence": [
        {
          "line": 1,
          "path": "tests/parity_tests.cpp",
          "type": "site"
        }
      ],
      "id": "e:3a3d5dcec3654da5",
      "kind": "test",
      "provenance": "static",
      "src": "file:tests/parity_tests.cpp"
    },
    {
      "count": 1,
      "dst": "file:src/mod/mod_matrix.cpp",
      "evidence": [
        {
          "line": 1,
          "path": "src/mod/lfo_env.cpp",
          "signature": "ModTarget::apply(IntentId, depth)",
          "type": "site"
        }
      ],
      "id": "e:42c9db49039b7c6f",
      "kind": "call",
      "provenance": "static",
      "role": "mod",
      "roleRule": "dsp-plugin/mod-by-signature",
      "src": "file:src/mod/lfo_env.cpp"
    },
    {
      "count": 1,
      "dst": "file:foundations/dsp_math.hpp",
      "evidence": [
        {
          "line": 1,
          "path": "src/engines/saw/kuramoto_core.cpp",
          "type": "site"
        }
      ],
      "id": "e:43b6bec6516ba664",
      "kind": "include",
      "provenance": "static",
      "src": "file:src/engines/saw/kuramoto_core.cpp"
    },
    {
      "count": 1,
      "dst": "file:foundations/smoother.hpp",
      "evidence": [
        {
          "line": 1,
          "path": "foundations/param_store.hpp",
          "type": "site"
        }
      ],
      "id": "e:4ab2fb2814c5096c",
      "kind": "include",
      "provenance": "static",
      "src": "file:foundations/param_store.hpp"
    },
    {
      "count": 1,